41 a 45 años,La Paz,"Ser mujer líder , independiente por sobre todo resiliente. ",Diplomado,Trabajo como dependiente,"Hablar idiomas extranjeros, no rendirme jamás y seguir estudiando,aprendiendo y emprendiendo cada día.","Poder capacitarme para poder conocer sobre estudio de mercados,  exportación e importación.",A través de mi empresa o emprendimiento,Si,Si,De lunes a viernes,Mañana,Hace más de un año,Inglés nómada.,Dictar clases de inglés a personas de bajos recursos,Educación y formación,Menos de 1 año,1 a 2 personas (incluida mi persona),Redes sociales Pista8,Facebook,Ser dueñas de su tiempo.,Marketing digital,Otras
26 a 30 años,La Paz,Adquirir conocimientos para poder lograr nuevas oportunidades ,Licenciatura,En búsqueda de empleo,"Atención al cliente , constancia, empatia",Ventas,Trabajo asalariado o eventual,,,,,,,,,,,,,Crecer personalmente y actualizar sus conocimientos.,Marketing digital,Resiliencia y Determinación
Más de 50 años,La Paz,Tengo un emprendimientoby quiero potenciarlo,Técnico medio o superior,Soy emprendedora,Disciplinada Positiva Perseverante,Tecnicas actualizadas de marketin,A través de mi empresa o emprendimiento,Si,Si,De lunes a viernes,Mañana,Hace más de un año,Palacio de los postres y tortas,Venta de tortas y postres,Gastronomía y/ó alimentos,Menos de 1 año,1 a 2 personas (incluida mi persona),Redes sociales Banco Sol,Facebook,Crecer personalmente y actualizar sus conocimientos.,Desarrollo personal y habilidades blandas,Resiliencia y Determinación
18 a 25 años,Santa Cruz,"Adquirir todo conocimiento posible, sobre todo modelos de negocio y diligencias a la hora de emprender, principales fuentes de financiamiento y como gestionarlas. Además rodearme de un entorno de personas emprendedoras será un gran estimulante a la hora de empezar algún emprendimiento",Licenciatura,Soy emprendedora,"1. Habilidades blandas desarrollas en base a experiencia. 
2. Autodidacta 
3. Conocimientos en economía y estadística.","1. Marketing estratégico. 
2. Gestionar fuentes de financiamiento.
3. Comunicación efectiva 
",Aún no percibo ingresos,,,,,,,,,,,,,Crecer personalmente y actualizar sus conocimientos.,Finanzas_financiamiento,Desarrollo Personal y Profesional
18 a 25 años,Cochabamba,"Soy emprendedora, ingeniera comercial con especialidad en marketing ",Licenciatura,En búsqueda de empleo,"Perseverancia, optimismo, superación ",Aprender cómo mejorar mi emprendimiento o cómo abrir y manejar uno,Trabajo asalariado o eventual,,,,,,,,,,,,,Mejorar el trabajo en equipo y aumentar las ventas de su emprendimiento.,Desarrollo personal y habilidades blandas,Resiliencia y Determinación
41 a 45 años,La Paz,"Trabajo de manera independiente y durante la pandemia tuve que reinventar mi modo de trabajo y la manera de acercarme a mis clientes, así que ando en constante búsqueda de nuevas herramientas, verme inmersa en la actualidad del mundo para poder ir a su ritmo, quisiera obtener nuevos conocimientos, retroalimentación y actualizarme con toda esta gente maravillosa que ya recorrió este camino del emprendimiento y estoy segura que serán un cofre del tesoro para descubrir todos sus conocimientos y la información que nos pueden dar. ",Diplomado,Trabajo como profesional independiente,"Puntualidad y disciplina siempre cumplo con lo que digo y ofrezco en mi trabajo. Empatía, tengo facilidad para conectar con la gente. Y me encanta hacer las cosas fijándome en los detalles, voy de lo general a lo particular porque eso es lo que nos gusta a todos, cuando nos hacen sentir que algo está especialmente pensado en uno y no es solo uno más de ese mar de ofertas.","Habilidades de servicios y herramientas digitales, hoy en día todo está en la red y si bien no lo manejo mal, me encantaría recibir una actualización de gente que estudia y trabaja por medios digitales. Llegar con mis servicios más allá de las fronteras de nuestra ciudad y luego cruzar las de nuestro país es mi ideal.",A través de mi empresa o emprendimiento,Si,Si,De lunes a viernes,Mañana,Hace más de un año,Expresate,"Exprésate inicio como un consultorio de fonoaudiología pediátrica. Durante la pandemia encontré la necesidad de trasladar los servicios al mundo digital, y así lo hice. Debido a las consultas, sugerencias y necesidad de la gente, amplíe los servicios a talleres dirigidos a los papás, facilitando el acceso y el acercamiento a las familias, y por el mismo motivo amplíe el trabajo a otras áreas que tienen que ver con mis carreras (literatura y fonoaudiología) realizando trabajo de manera híbrida (presencial y virtual) que hasta la actualidad es requerido por las familias.",Servicios profesionales y/ó consultorías,De 1 a 5 años,1 a 2 personas (incluida mi persona),Redes sociales Pista8,Instagram,Crecer personalmente y actualizar sus conocimientos.,Marketing digital,Emprendimiento e Innovación
26 a 30 años,La Paz,Ampliar mis conocimientos en el ámbito del emprendimiento porque si quiero garantizar un buen producto que tenga respaldo. ,Bachiller,Aún me encuentro estudiando,"Entradora en cualquier lugar donde me pongan a vender o ofrecer algún producto lo vendería. 
Ágil me gusta moverme de un lado a otro. 
Me gusta investigar en las redes sociales productos más vendidos y a un buen precio. ","Estrategias para lograr alcanzar mayores objetivos. 
Socializar con otras personas porque hay ideas que convinan y puede que sume en el emprendimiento. 
Y crecer como profesional como es en la práctica. ",Aún no percibo ingresos,,,,,,,,,,,,,Crecer personalmente y actualizar sus conocimientos.,Toma de decisiones y negociación,Emprendimiento e Innovación
31 a 35 años,Santa Cruz,Poder potenciar mis habilidades empresariales para liderar de mejor forma mi emprendimiento y hacerlo crecer.,Diplomado,Trabajo como profesional independiente,"Tengo sólidos conocimientos en el rubro de alimentos (principalmente en diseño y desarrollo de productos). Soy una mujer perseverante, resiliente y con muchas ganas de superación.","Desarrollar actividades en las áreas de finanzas, comercial y marketing.",A través de mi empresa o emprendimiento,Si,Si,De lunes a viernes,Mañana,Hace más de 5 años,Alimentos Sofar,"Alimentos Sofar es una empresa familiar, creada a finales del 2017 (SOFAR por los nombres de mis hijos: SOFia y ARturo). 
Debido a la demanda de productos listos para consumir, vimos una oportunidad de negocio en el segmento de salsas y aderezos. Iniciamos en el mercado formal con 5 productos: Salsas picantes distintas en sabor e intensidad.
Empezamos a comercializar los productos en marzo del 2018 en supermercados (Inicialmente Hipermaxi luego Fidalga, Tia, IC Norte) y carnicerías locales.
En el año 2020 se desarrollaron nuevos productos (salsas de queso y conservas) y logramos introducir nuestra variedad en el departamento de Cochabamba (Hipermaxi, Ic Norte) y el 2021 en el supermercado Ketal de La Paz. 
Los productos SOFAR están dirigidos a las personas que disfrutan acompañar sus comidas con aderezos. Contamos con una variedad de salsas picantes, salsas de queso y conservas. Son elaborados artesanalmente con ingredientes seleccionados y gracias al proceso de pasteurizado y sellado al vacío tienen una larga duración.
Nuestro cliente objetivo es una persona (entre 25 a 40 años) que le gusta confraternizar, juntarse con amigos, tener tiempo para despejar la mente de la rutina. Es por esto que ofrecemos productos listos para consumir, atractivos a la vista y al paladar.
Nuestros productos tienen ventaja competitiva ya que son elaborados con ingredientes de alta calidad y se encuentran en diversas presentaciones y sabores.",Gastronomía y/ó alimentos,De 1 a 5 años,3 y 5 personas (incluida mi persona),Redes sociales Pista8,Facebook,Crecer personalmente y actualizar sus conocimientos.,Finanzas_financiamiento,Emprendimiento e Innovación
18 a 25 años,El Alto,"Quiero mejorar, aprender habilidades que me ayuden a ser grande",Bachiller,Soy emprendedora,"Perseverancia, alegría, pongo atención y solución a problemas ","Legales para mi emprendimiento, ve tas, marketing conseguir nuevos mercados ",A través de mi empresa o emprendimiento,Si,Si,De lunes a viernes,Noche,Hace más de un año,Aristel ,"Elaboramos desayunos instantáneos de soya, quinoa, wilcalaru con lo sin eche, de fácil preparación y accesible a el bolsillo de las familias.",Gastronomía y/ó alimentos,De 1 a 5 años,3 y 5 personas (incluida mi persona),Redes sociales Pista8,Facebook,Crecer personalmente y actualizar sus conocimientos.,Marketing digital,Resiliencia y Determinación
26 a 30 años,El Alto,Aprender y ejecutar en mi emprendimiento ,Licenciatura,Soy emprendedora,Responsable puntual proactiva ,Mejorar en mi inseguridad ,A través de mi empresa o emprendimiento,Si,Si,Fines de semana,Tarde,Hace más de un año,Alana tejidos ,Realizamos prendas tejidas a mano ,"Textil, moda, diseño y/ó venta de ropa",De 1 a 5 años,Más de 5 (incluida mi persona),Redes sociales Banco Sol,Facebook,Mejorar el trabajo en equipo y aumentar las ventas de su emprendimiento.,Desarrollo personal y habilidades blandas,Liderazgo y Empoderamiento
26 a 30 años,La Paz,Aprender herramientas que me ayuden a gestionar mi tiempo y desarrollar habilidades de manejo de decisiones para crecer en mi emprendimiento ,Post grado,Soy emprendedora,"Organización , detallista y creativa ","Manejo de redes sociales , capacidad de comunicación con verbal y metodológia de costos ",A través de mi empresa o emprendimiento,No,Si,Fines de semana,Mañana,Hace más de un año,BAMBOLA BEAUTY ,"Tienda online de skincare que busca llegar a todas las personas que deseen cuidar de su piel , no solo por belleza sino como un gesto de amor propio. ","Belleza, cuidado personal",De 1 a 5 años,1 a 2 personas (incluida mi persona),Redes sociales Pista8,Facebook,Crecer personalmente y actualizar sus conocimientos.,Finanzas_financiamiento,Resiliencia y Determinación
26 a 30 años,El Alto,Adquirir muchos conocimientos y tener un equipo donde podamos trabajar juntas ,Técnico medio o superior,Aún me encuentro estudiando,"Comunicación, se usar mucho las herramientas Tics y soy muy versátil ","Emprendimiento, conocer más personas para formar un equipo ",Aún no percibo ingresos,,,,,,,,,,,,,Crecer personalmente y actualizar sus conocimientos.,Desarrollo personal y habilidades blandas,Resiliencia y Determinación
41 a 45 años,La Paz,Aprender,Licenciatura,Soy emprendedora,"Perseverancia, motivación y compromiso con lo que hago","Estrategias, marketing ",A través de mi empresa o emprendimiento,Si,Si,De lunes a viernes,Mañana,Hace más de un año,Ser verde ,Venta de productos saludables,Actividad comercial,De 1 a 5 años,1 a 2 personas (incluida mi persona),Redes sociales Banco Sol,Facebook,Aprender más sobre estrategias de marketing y el uso de nuevas tecnologías.,Toma de decisiones y negociación,Resiliencia y Determinación
41 a 45 años,Cochabamba,Mis hijos y mejorar mi emprendimiento,Técnico medio o superior,Trabajo y emprendo como actividad paralela,Costura..sublimación y corte,Todo sobre confecciones y sublimación ,De ambos (trabajo y emprendimiento),Si,Si,Fines de semana,Noche,Hace más de 5 años,Candy sports,Confección d ropa deportiva ,"Textil, moda, diseño y/ó venta de ropa",De 1 a 5 años,Sólo yo,Redes sociales Banco Sol,Facebook,Mejorar el trabajo en equipo y aumentar las ventas de su emprendimiento.,Otro,Otras
Más de 50 años,Cochabamba,Crear una empresa de jabones artesanales en Bolivia,Licenciatura,Soy emprendedora,"Liderazgo,  curiosidad, servicio.","Aprender más sobre jabones, cremas , shampoo a rtesanales",De ambos (trabajo y emprendimiento),Si,Si,Indiferente,Tarde,Hace menos de 1 año,"""Tu Escencia"" salud y belleza",Jabones y cremas faciales artesanales,"Belleza, cuidado personal",Menos de 1 año,Sólo yo,Redes sociales Banco Sol,YouTube ,Mejorar el trabajo en equipo y aumentar las ventas de su emprendimiento.,Otro,Emprendimiento e Innovación
Más de 50 años,Cochabamba,Crear una empresa de productos de Salud y belleza artesanales.,Licenciatura,Soy emprendedora,"Liderazgo, curiosidad y atrevimiento ",Saber más sobre productos sobre salud y belleza artesanales,De ambos (trabajo y emprendimiento),Si,Si,De lunes a viernes,Tarde,Hace menos de 1 año,"""Tu Escencia""salud y belleza.",Productos artesanales para salud y belleza,"Belleza, cuidado personal",Menos de 1 año,Sólo yo,Redes sociales Banco Sol,YouTube ,Mejorar el trabajo en equipo y aumentar las ventas de su emprendimiento.,Finanzas_financiamiento,Liderazgo y Empoderamiento
36 a 40 años,Cochabamba,Necesito aprender mas para poder hacer crecer mi emprendimiento ,Técnico medio o superior,Soy emprendedora,"Confianza en mi capacidad , compromiso, decidión",Sobre el manejo financiero de un emprendimiento ,Aún no percibo ingresos,,,,,,,,,,,,,Crecer personalmente y actualizar sus conocimientos.,Herramientas digitales,Desarrollo Personal y Profesional
18 a 25 años,El Alto,Espero iniciar un pequeño emprendimiento ,Licenciatura,En búsqueda de empleo,"Perseverancia, responsabilidad y compromiso",Generar una base sólida para poder iniciar un emprendimiento ,Aún no percibo ingresos,,,,,,,,,,,,,Mejorar el trabajo en equipo y aumentar las ventas de su emprendimiento.,Desarrollo personal y habilidades blandas,Resiliencia y Determinación
Más de 50 años,La Paz,Aprender nuevas formas para emprender y así ganar experiencia,Bachiller,Soy emprendedora,"-conectar con las personas
-creativa
-pasión por la comida",La forma de emprender de mejor manera ,A través de mi empresa o emprendimiento,No,Si,De lunes a viernes,Mañana,Hace más de un año,Repostería casera ,Realización de pasteles y masitas ,Gastronomía y/ó alimentos,De 1 a 5 años,Sólo yo,Redes sociales Banco Sol,WhatsApp,Aprender más sobre estrategias de marketing y el uso de nuevas tecnologías.,Desarrollo personal y habilidades blandas,Trabajo en Equipo y Colaboración
26 a 30 años,Santa Cruz,Mi motivación es crecer profesionalmente para poder en un futuro ayudar a todas las mujeres o personas que sean emprendedoras al igual que yo y necesiten ese apoyo para seguir creciendo,Diplomado,Trabajo y emprendo como actividad paralela,"Destacó la perseverancia en mi persona, que no se rinde ante mis objetivos, soy una persona que se adapta al cambio y busca la excelencia en el trabajo","Quiero adquirir conocimientos de herramientas que me permitan dar el siguiente paso en mi emprendimiento, como también tener el rose empresarial y adquirir nuevos contactos ",De ambos (trabajo y emprendimiento),Si,Si,Indiferente,Mañana,Hace más de un año,Moobbe,"Moobbe es una plataforma generadora de carga, enfocada en conectar al transportista con el cliente o generador de carga, brindando transparencia en los tiempos de pago y precios del servicio ",Tecnología,Menos de 1 año,1 a 2 personas (incluida mi persona),Redes sociales Pista8,Linkedin,Crecer personalmente y actualizar sus conocimientos.,Finanzas_financiamiento,Resiliencia y Determinación
41 a 45 años,Cochabamba,Mejorar mi economia familiar ,Licenciatura,Soy emprendedora,"Responsable, trabajo bajo presión, no le tengo miedo a los cambios","Actualizarme mas en lo tecnológico, llegar a mas clientes para potenciar mi empresa",A través de mi empresa o emprendimiento,Si,Si,Fines de semana,Noche,Hace más de 10 años,Distribución de agua en botellón ,Purificacion y filtracion de agua distribución de agua en botellón ,Gastronomía y/ó alimentos,Más de 10 años,3 y 5 personas (incluida mi persona),Redes sociales Pista8,Facebook,Mejorar el trabajo en equipo y aumentar las ventas de su emprendimiento.,Finanzas_financiamiento,Liderazgo y Empoderamiento
36 a 40 años,Cochabamba,Deseo potenciar mis habilidades y fortalecer mi espíritu emprendedor con nuevos conocimientos. ,Diplomado,Soy emprendedora,"Comunicación visual, fotografía y manejo de TICs","Conocimiento de MKT digital, SEO, habilidades gerenciales.",A través de mi empresa o emprendimiento,Si,Si,Fines de semana,Mañana,Hace menos de 1 año,Game On Store,"Tienda digital, venta equipos y juegos.",Tecnología,Menos de 1 año,Sólo yo,Redes sociales Banco Sol,Facebook,Crecer personalmente y actualizar sus conocimientos.,Marketing digital,Comunicación y Redes
26 a 30 años,Cochabamba,Aprender y mejorar las ventas de mi emprendimiento tener más conocimiento para dar empleos a más personas ,Técnico medio o superior,Trabajo y emprendo como actividad paralela,"Perseverancia
Constancia 
Me gusta mucho mi trabajo mi emprendimiento me agrada como se refleja hacia las personas ","Mejorar ventas
Manejo de negocios
Cierre de ventas
",De ambos (trabajo y emprendimiento),Si,Si,Indiferente,Mañana,Hace más de un año,Paletas CANDY ,"Es un emprendimiento de paletas artesanales a base de pura pulpa de fruta mantenimiento lo saludable de la fruta no usamos colorantes ni saborizantes artificiales tenemos sabores exoticos como copoazu maracuya
Tumbo flor de jamaica",Gastronomía y/ó alimentos,De 1 a 5 años,1 a 2 personas (incluida mi persona),Redes sociales Banco Sol,Facebook,Crecer personalmente y actualizar sus conocimientos.,Finanzas_financiamiento,Emprendimiento e Innovación
26 a 30 años,La Paz,"Crecer con mi negocio, hacer conexiones y aprender más ",Licenciatura,Trabajo como profesional independiente,"Soy emprendedora, creativa y líder. ",Me gustaría saber más de negocios y networking para crecer. ,De ambos (trabajo y emprendimiento),Si,Si,Indiferente,Tarde,Hace más de un año,Carolina Limachi (por lanzar SparkLab),Me dedico a la creación de productos digitales sobre Marketing Digital para emprendedores y asesorías sobre Marca Personal.,Servicios profesionales y/ó consultorías,De 1 a 5 años,Sólo yo,Redes sociales Banco Sol,Facebook,Crecer personalmente y actualizar sus conocimientos.,Finanzas_financiamiento,Emprendimiento e Innovación
26 a 30 años,Santa Cruz,Para tener más conocimiento soy una mujer empoderada ,Técnico medio o superior,Soy emprendedora,Que no me doy por vencida ,Interessante que ayuden ala mujeres,A través de mi empresa o emprendimiento,Si,Si,Fines de semana,Mañana,Hace más de un año,Delitotai ,Elaborar producto de pulpa de totai,Gastronomía y/ó alimentos,De 1 a 5 años,Sólo yo,Redes sociales Banco Sol,Facebook,Crecer personalmente y actualizar sus conocimientos.,Desarrollo personal y habilidades blandas,Otras
26 a 30 años,La Paz,Poder empoderar  a las mujeres en el mundo del negocio. ,Licenciatura,Soy emprendedora,"Responsabilidad, creatividad y resiliencia ",Todo los que pueda. ,A través de mi empresa o emprendimiento,Si,Si,De lunes a viernes,Noche,Hace más de un año,Zoe Tejidos,"Emprendimiento de tejido de amigurumis con lana reciclada, apoyando la economía naranja. ",Artesanía y manualidades,De 1 a 5 años,Sólo yo,Redes sociales Banco Sol,Facebook,Mejorar el trabajo en equipo y aumentar las ventas de su emprendimiento.,Otro,Creatividad y Solución de Problemas
31 a 35 años,Cochabamba,Motivación superarme como persona ,Bachiller,Soy emprendedora,Aprender nuevas cosas ,Aprender más para poder tener un mejor conocimiento ,A través de mi empresa o emprendimiento,Si,Si,De lunes a viernes,Mañana,Hace más de un año,La moda en un clik,Venta de ropa y artículos ,"Textil, moda, diseño y/ó venta de ropa",De 1 a 5 años,Sólo yo,Redes sociales Banco Sol,Facebook,Crecer personalmente y actualizar sus conocimientos.,Desarrollo personal y habilidades blandas,Emprendimiento e Innovación
31 a 35 años,Santa Cruz,Obtener nuevas herramientas para hacer crecer mi emprendimiento ,Técnico medio o superior,Soy emprendedora,"Creativa, perseverancia y aprendo rápido ","Manejo de redes, y marketing ",A través de mi empresa o emprendimiento,Si,Si,Fines de semana,Noche,Hace más de un año,Crohilitos ,Accesorios tejidos a crohet para niños y niñas,Artesanía y manualidades,De 1 a 5 años,Sólo yo,Redes sociales Banco Sol,Facebook,Crecer personalmente y actualizar sus conocimientos.,Marketing digital,Resiliencia y Determinación
31 a 35 años,Cochabamba,Quiero tener las herramientas para poder hacer crecer mi emprendimiento. Antes ya pasé seminarios de Bancosol ,Licenciatura,Soy emprendedora,"Liderazgo, perseverancia y creatividad","Marketing digital, costos e inventarios",A través de mi empresa o emprendimiento,Si,Si,Fines de semana,Noche,Hace más de un año,Smile Pet ,"Ropa, camas y accesorios para mascotas personalizadas ","Textil, moda, diseño y/ó venta de ropa",De 1 a 5 años,3 y 5 personas (incluida mi persona),Redes sociales Banco Sol,Facebook,Crecer personalmente y actualizar sus conocimientos.,Finanzas_financiamiento,Liderazgo y Empoderamiento
26 a 30 años,El Alto,Poder ayudar a mis padres y tener un negocio que genere empleavilidad ,Licenciatura,En búsqueda de empleo,"Puntualidad ,respeto y trabajo en equipo",Mejorar aun los conocimientos ,Aún no percibo ingresos,,,,,,,,,,,,,Mejorar el trabajo en equipo y aumentar las ventas de su emprendimiento.,Desarrollo personal y habilidades blandas,Trabajo en Equipo y Colaboración
36 a 40 años,Santa Cruz,Adquirir conocimientos y herramientas que me ayuden a potenciar. Mis habilidades y a despertar aun mas mis ideas ,Licenciatura,Soy emprendedora,"Responsabilidad,perseverancia y siempre positiva ","Liderazgo, confianza ",A través de mi empresa o emprendimiento,Si,Si,Indiferente,Mañana,Hace más de un año,Atenea curveme,Productos de belleza y vitaminas,"Belleza, cuidado personal",De 1 a 5 años,Sólo yo,Redes sociales Banco Sol,WhatsApp,Crecer personalmente y actualizar sus conocimientos.,Desarrollo personal y habilidades blandas,Resiliencia y Determinación
26 a 30 años,Cochabamba,Deseo de aprender y mejorar ,Post grado,Soy emprendedora,Conocimiento de marketing y ventas así como algo de liderazgo ,Más que todo ampliar mis conocimientos en desarrollo de negocios y estrategias ,De ambos (trabajo y emprendimiento),Si,Si,De lunes a viernes,Noche,Hace más de un año,Essens,"Essens se dedica a la elaboración de cosméticos a base de extractos naturales, como ser champú, acondicionador, cremas, geles entre otros","Belleza, cuidado personal",De 1 a 5 años,1 a 2 personas (incluida mi persona),Redes sociales Pista8,Facebook,Mejorar el trabajo en equipo y aumentar las ventas de su emprendimiento.,Toma de decisiones y negociación,Liderazgo y Empoderamiento
26 a 30 años,Santa Cruz,Mis hijos son mi motivación y Hacer crecer mi emprendimiento para generar más ingresos,Bachiller,Soy emprendedora,"Persistente, soñadora y creativa",Marketing y publicidad ,A través de mi empresa o emprendimiento,Si,No,Fines de semana,Tarde,Hace menos de 1 año,Dely and Dely,"Comida: silpanchos, hamburguesas y pollo a la broasterd",Gastronomía y/ó alimentos,Menos de 1 año,1 a 2 personas (incluida mi persona),Redes sociales Banco Sol,Facebook,Crecer personalmente y actualizar sus conocimientos.,Marketing digital,Resiliencia y Determinación
46 a 50 años,La Paz,Aumentar conocimientos de emprendimiento,Maestria,Trabajo como profesional independiente,"Perseverancia, compromiso y responsabilidad.",Innovación de emprendimiento,Trabajo asalariado o eventual,,,,,,,,,,,,,Crecer personalmente y actualizar sus conocimientos.,Otro,Resiliencia y Determinación
31 a 35 años,La Paz,Mi motivación es lograr hacer que mi empresa sea un referente en su rubro a nivel nacional e internacional ,Técnico medio o superior,Soy emprendedora,"Constante, determinada y ambiciosa","Desarrollar el area financiera, posicionar mi marca y liderazgo ",A través de mi empresa o emprendimiento,Si,Si,De lunes a viernes,Mañana,Hace más de un año,Sin Par calzados ,"Somos una empresa que realiza calzados de cuero a a medida, donde cada producto es único y hecho a mano con la máxima calidad.
Contamos con expertos artesanos bolivianos en cuero para realizar estas obras que destacan en los pies ",Manufactura,De 1 a 5 años,3 y 5 personas (incluida mi persona),Redes sociales Banco Sol,Facebook,Mejorar el trabajo en equipo y aumentar las ventas de su emprendimiento.,Finanzas_financiamiento,Resiliencia y Determinación
46 a 50 años,Cochabamba,Aprender más ,Técnico medio o superior,En búsqueda de empleo,"Ser persistente,  empática",Me gustaría saber más sobre Emprender,Trabajo asalariado o eventual,,,,,,,,,,,,,Aprender más sobre estrategias de marketing y el uso de nuevas tecnologías.,Desarrollo personal y habilidades blandas,Resiliencia y Determinación
36 a 40 años,Cochabamba,Para conocer nuevas pautas para hacer crecer mi emprendimiento.,Licenciatura,Soy emprendedora,"Versatilidad, inteligente,confianza.","Incrementar mi conocimiento con experiencia de otros emprendedores,habilidad en el ámbito virtual.",A través de mi empresa o emprendimiento,No,Si,Indiferente,Tarde,Hace más de 10 años,Arnezbol ,Fabrica de colchones ortopedicos  y semiortopedicos.,Actividad comercial,Más de 10 años,3 y 5 personas (incluida mi persona),Redes sociales Banco Sol,Facebook,Crecer personalmente y actualizar sus conocimientos.,Desarrollo personal y habilidades blandas,Flexibilidad y Adaptabilidad
36 a 40 años,La Paz,Obtener más conocimientos,Licenciatura,Trabajo y emprendo como actividad paralela,"Creatidad, perseverancia y liderazgo","Comunicación Digital, Big Data y Finanzas",A través de mi empresa o emprendimiento,Si,No,De lunes a viernes,Noche,Hace más de 10 años,Lady Glam,Producción y comercialización de Calzados Femeninos,Manufactura,6 a 10 años,3 y 5 personas (incluida mi persona),Redes sociales Banco Sol,Facebook,Crecer personalmente y actualizar sus conocimientos.,Finanzas_financiamiento,Liderazgo y Empoderamiento
36 a 40 años,La Paz,Emprender ,Técnico medio o superior,Soy emprendedora,"Repostería, cocina ",Marketing y finanzas ,Trabajo asalariado o eventual,,,,,,,,,,,,,Otro,Finanzas_financiamiento,Otras
